<?xml version="1.0" encoding="UTF-8"?>
<!ELEMENT Students (student+)>
<!ELEMENT student (regno,name,marks,email,class)>
<!ELEMENT regno (#PCDATA)>
<!ELEMENT name (#PCDATA)>
<!ELEMENT marks (#PCDATA)>
<!ELEMENT email (#PCDATA)>
<!ELEMENT class (#PCDATA)>
<!ATTLIST student sid  ID #REQUIRED>